Attribute,Description,Valid Values,DependsOn,Properties,Required,Parent,DependsOn Component,Source,Validation Rules,columnType,module
species,The name of a species (typically a taxonomic group) of organism.,"Human, Mouse, Rat, Drosophila melanogaster, Rhesus macaque, Pan troglodytes, Gallus gallus, Sus scrofa",,,True,DataProperty,,sage.annotations-experimentalData.species-0.0.2,,string,individual
Human,Homo sapiens with taxonomy ID: 9606 and Genbank common name: human,,,,,species,,https://www.ncbi.nlm.nih.gov/Taxonomy/Browser/wwwtax.cgi?mode=Info&id=9606&lvl=3&lin=f&keep=1&srchmode=1&unlock,,string,individual
Mouse,Mus musculus with taxonomy ID: 10090 and Genbank common name: house mouse,,,,,species,,https://www.ncbi.nlm.nih.gov/Taxonomy/Browser/wwwtax.cgi?mode=Info&id=10090&lvl=3&lin=f&keep=1&srchmode=1&unlock,,string,individual
Rat,Rattus with taxonomy ID: 10114 and inherited blast name: rodents,,,,,species,,https://www.ncbi.nlm.nih.gov/Taxonomy/Browser/wwwtax.cgi?mode=Info&id=10114&lvl=3&lin=f&keep=1&srchmode=1&unlock,,string,individual
Drosophila melanogaster,Drosophila melanogaster with taxonomy ID: 7227 and Genbank common name: fruit fly,,,,,species,,https://www.ncbi.nlm.nih.gov/Taxonomy/Browser/wwwtax.cgi?mode=Info&id=7227&lvl=3&p=has_linkout&p=blast_url&p=genome_blast&p=mapview&lin=f&keep=1&srchmode=1&unlock,,string,individual
Rhesus macaque,Macaca mulatta with taxonomy ID: 9544 and Genbank common name: Rhesus monkey,,,,,species,,https://www.ncbi.nlm.nih.gov/Taxonomy/Browser/wwwtax.cgi?mode=Info&id=9544&lvl=3&p=has_linkout&p=blast_url&p=genome_blast&p=mapview&lin=f&keep=1&srchmode=1&unlock,,string,individual
Pan troglodytes,Pan troglodytes with taxonomy ID: 9598 and Genbank common name: chimpanzee,,,,,species,,https://www.ncbi.nlm.nih.gov/Taxonomy/Browser/wwwtax.cgi?mode=Info&id=9598&lvl=3&lin=f&keep=1&srchmode=1&unlock,,string,individual
Gallus gallus,"The common domestic fowl, Chicken.",,,,,species,,https://www.ncbi.nlm.nih.gov/Taxonomy/Browser/wwwtax.cgi?mode=Info&id=9031,,string,individual
Sus scrofa,Sus scrofa with taxonomy ID: 9823 and Genbank common name: pig,,,,,species,,https://www.ncbi.nlm.nih.gov/Taxonomy/Browser/wwwtax.cgi?mode=Info&id=9823,,string,individual
